{
  "id": "redewendungen",
  "title": "Redewendungen & Sprichwörter",
  "shortDescription": "Typische bildhafte Redensarten aus dem deutschen Alltag",
  "icon": "💡",
  "level": "B1 – C2",
  "color": "#f59e0b",
  "totalExercises": 12,
  "exercises": [
    {
      "id": "red-1",
      "prefix": "Morgen hast du deine praktische Fahrprüfung? Ich werde dir ganz fest die Daumen",
      "gapPlaceholder": "Verb",
      "suffix": "!",
      "correctAnswer": "drücken",
      "acceptableAnswers": [
        "drücken",
        "druecken"
      ],
      "options": [
        "drücken",
        "halten",
        "drehen",
        "zeigen"
      ],
      "collocation": "die Daumen drücken",
      "meaning": "jemandem Glück und Erfolg für eine Prüfung oder Herausforderung wünschen",
      "example": "Ich drücke dir für das Vorstellungsgespräch alle Daumen!",
      "tip": "Verb 'drücken' (im Englischen: to cross one's fingers)."
    },
    {
      "id": "red-2",
      "prefix": "Wenn ich auf dem Weg zur Post auch gleich einkaufe, schlage ich zwei Fliegen mit einer",
      "gapPlaceholder": "Nomen",
      "suffix": ".",
      "correctAnswer": "Klappe",
      "acceptableAnswers": [
        "Klappe",
        "klappe"
      ],
      "options": [
        "Klappe",
        "Hand",
        "Falle",
        "Kelle"
      ],
      "collocation": "zwei Fliegen mit einer Klappe schlagen",
      "meaning": "zwei Dinge mit einem einzigen Aufwand gleichzeitig erledigen",
      "example": "Mit der Fahrgemeinschaft sparen wir Geld und schonen das Klima – zwei Fliegen mit einer Klappe!",
      "tip": "Substantiv: die Klappe (ursprünglich von der Fliegenklappe)."
    },
    {
      "id": "red-3",
      "prefix": "Mit seiner unbedachten Bemerkung über das Alter der Chefin ist er voll ins Fettnäpfchen",
      "gapPlaceholder": "Partizip II",
      "suffix": ".",
      "correctAnswer": "getreten",
      "acceptableAnswers": [
        "getreten"
      ],
      "options": [
        "getreten",
        "gefallen",
        "gesprungen",
        "geraten"
      ],
      "collocation": "ins Fettnäpfchen treten",
      "meaning": "sich ungeschickt oder peinlich verhalten und jemanden kränken",
      "example": "Da bin ich wohl ins Fettnäpfchen getreten, tut mir leid!",
      "tip": "Partizip II des unregelmäßigen Verbs 'treten' (treten - trat - getreten)."
    },
    {
      "id": "red-4",
      "prefix": "Es reicht mir jetzt wirklich! Ich habe die Nase gestrichen",
      "gapPlaceholder": "Adjektiv",
      "suffix": "von diesen ständigen Ausreden.",
      "correctAnswer": "voll",
      "acceptableAnswers": [
        "voll"
      ],
      "options": [
        "voll",
        "leer",
        "satt",
        "fertig"
      ],
      "collocation": "die Nase voll haben von (+ Dativ)",
      "meaning": "von einer Situation oder Person völlig genervt sein",
      "example": "Ich habe die Nase voll vom ständigen Stau am Morgen.",
      "tip": "Redewendung: 'die Nase (gestrichen) voll haben'."
    },
    {
      "id": "red-5",
      "prefix": "Hör bitte auf mit den Ausflüchten und schenk mir endlich reinen",
      "gapPlaceholder": "Nomen",
      "suffix": "ein!",
      "correctAnswer": "Wein",
      "acceptableAnswers": [
        "Wein",
        "wein"
      ],
      "options": [
        "Wein",
        "Saft",
        "Tee",
        "Kaffee"
      ],
      "collocation": "reinen Wein einschenken",
      "meaning": "jemandem die ungeschminkte Wahrheit sagen",
      "example": "Es ist besser, ihm gleich reinen Wein einzuschenken, als ihn zu belügen.",
      "tip": "Maskulines Substantiv: der Wein."
    },
    {
      "id": "red-6",
      "prefix": "Das Schild stand direkt vor deiner Nase. Hast du etwa Tomaten auf den",
      "gapPlaceholder": "Nomen (Plural)",
      "suffix": "?",
      "correctAnswer": "Augen",
      "acceptableAnswers": [
        "Augen",
        "augen"
      ],
      "options": [
        "Augen",
        "Ohren",
        "Händen",
        "Fingern"
      ],
      "collocation": "Tomaten auf den Augen haben",
      "meaning": "etwas völlig Offensichtliches übersehen oder nicht wahrnehmen",
      "example": "Ich habe meinen Schlüssel gesucht, obwohl er direkt vor mir lag – echte Tomaten auf den Augen!",
      "tip": "Pluralform von 'das Auge'."
    },
    {
      "id": "red-7",
      "prefix": "Bei dem schweren Glatteisunfall ist niemandem etwas passiert – da haben alle echtes",
      "gapPlaceholder": "Nomen",
      "suffix": "gehabt!",
      "correctAnswer": "Schwein",
      "acceptableAnswers": [
        "Schwein",
        "schwein"
      ],
      "options": [
        "Schwein",
        "Pferd",
        "Huhn",
        "Glückchen"
      ],
      "collocation": "Schwein haben",
      "meaning": "großes, unerwartetes Glück im Unglück haben",
      "example": "Der Zug hatte Verspätung, so haben wir ihn noch erwischt. Da hatten wir Schwein!",
      "tip": "Typisch deutsche umgangssprachliche Wendung für Glück (das Schwein)."
    },
    {
      "id": "red-8",
      "prefix": "Deine Vermutung stimmt leider überhaupt nicht, du bist völlig auf dem",
      "gapPlaceholder": "Nomen",
      "suffix": ".",
      "correctAnswer": "Holzweg",
      "acceptableAnswers": [
        "Holzweg",
        "holzweg"
      ],
      "options": [
        "Holzweg",
        "Umweg",
        "Irrweg",
        "Waldweg"
      ],
      "collocation": "auf dem Holzweg sein",
      "meaning": "sich gründlich irren oder eine falsche Schlussfolgerung ziehen",
      "example": "Wer glaubt, Deutsch lerne sich von allein, ist auf dem Holzweg.",
      "tip": "Zusammengesetztes Nomen: das Holz + der Weg = der Holzweg."
    },
    {
      "id": "red-9",
      "prefix": "Mit deiner treffenden Bemerkung hast du den Nagel genau auf den",
      "gapPlaceholder": "Nomen",
      "suffix": "getroffen.",
      "correctAnswer": "Kopf",
      "acceptableAnswers": [
        "Kopf",
        "kopf"
      ],
      "options": [
        "Kopf",
        "Punkt",
        "Boden",
        "Tisch"
      ],
      "collocation": "den Nagel auf den Kopf treffen",
      "meaning": "etwas ganz genau und treffend benennen oder beschreiben",
      "example": "Ihre Erklärung traf den Nagel auf den Kopf.",
      "tip": "Maskulines Substantiv: der Kopf (Akkusativ: auf den Kopf)."
    },
    {
      "id": "red-10",
      "prefix": "Nur weil die erste Bewerbung abgelehnt wurde, solltest du nicht gleich die Flinte ins",
      "gapPlaceholder": "Nomen",
      "suffix": "werfen.",
      "correctAnswer": "Korn",
      "acceptableAnswers": [
        "Korn",
        "korn"
      ],
      "options": [
        "Korn",
        "Gras",
        "Feld",
        "Wasser"
      ],
      "collocation": "die Flinte ins Korn werfen",
      "meaning": "vorzeitig den Mut verlieren oder entmutigt aufgeben",
      "example": "Gib noch nicht auf und wirf nicht gleich die Flinte ins Korn!",
      "tip": "Historische Redewendung: ins Korn (das Getreidefeld) werfen."
    },
    {
      "id": "red-11",
      "prefix": "Weil es sein allererstes Versehen war, wollte der Prüfer noch einmal ein Auge",
      "gapPlaceholder": "Verb",
      "suffix": ".",
      "correctAnswer": "zudrücken",
      "acceptableAnswers": [
        "zudrücken",
        "zudruecken"
      ],
      "options": [
        "zudrücken",
        "schließen",
        "zumachen",
        "öffnen"
      ],
      "collocation": "ein Auge zudrücken",
      "meaning": "einen kleineren Fehler wohlwollend nachsehen oder ignorieren",
      "example": "Die Lehrerin drückte bei der Verspätung noch ein Auge zu.",
      "tip": "Zusammengesetztes trennbares Verb: 'zudrücken'."
    },
    {
      "id": "red-12",
      "prefix": "Als die Mitarbeiter von der plötzlichen Werksschließung erfuhren, fielen sie aus allen",
      "gapPlaceholder": "Nomen",
      "suffix": ".",
      "correctAnswer": "Wolken",
      "acceptableAnswers": [
        "Wolken",
        "wolken"
      ],
      "options": [
        "Wolken",
        "Himmeln",
        "Träumen",
        "Sternen"
      ],
      "collocation": "aus allen Wolken fallen",
      "meaning": "völlig überrascht und schockiert über eine Nachricht sein",
      "example": "Bei der Bekanntgabe des Ergebnisses fiel ich aus allen Wolken.",
      "tip": "Pluralform von 'die Wolke': aus allen Wolken."
    }
  ]
}